{
  "$schema": "https://json-schema.org/draft/2020-12/schema",
  "$id": "https://github.com/AstralDeep/AstralDeep/contracts/system-composition.schema.json",
  "title": "Astral System Composition Manifest",
  "description": "Pins the four independent component revisions and their compatibility contracts. The containing AstralDeep commit is joined externally with the canonical manifest digest to avoid a self-reference.",
  "type": "object",
  "additionalProperties": false,
  "required": [
    "format",
    "astraldeep_contract_version",
    "components",
    "availability",
    "compatibility"
  ],
  "properties": {
    "format": {
      "const": "astral.composition/v1"
    },
    "astraldeep_contract_version": {
      "const": "astraldeep.composition/v1"
    },
    "components": {
      "type": "object",
      "additionalProperties": false,
      "required": [
        "astral-projection",
        "astral-plane",
        "astral-primitives",
        "lets"
      ],
      "properties": {
        "astral-projection": {
          "$ref": "#/$defs/projectionComponent"
        },
        "astral-plane": {
          "$ref": "#/$defs/planeComponent"
        },
        "astral-primitives": {
          "$ref": "#/$defs/primitivesComponent"
        },
        "lets": {
          "$ref": "#/$defs/letsComponent"
        }
      }
    },
    "availability": {
      "type": "object",
      "additionalProperties": false,
      "required": [
        "astral-projection",
        "astral-plane",
        "astral-primitives",
        "lets"
      ],
      "properties": {
        "astral-projection": {
          "const": "required-embedded"
        },
        "astral-plane": {
          "const": "required-embedded"
        },
        "astral-primitives": {
          "const": "required-embedded"
        },
        "lets": {
          "const": "external-feature-gated"
        }
      }
    },
    "compatibility": {
      "type": "object",
      "additionalProperties": false,
      "required": [
        "ui_protocol",
        "data_plane",
        "primitives",
        "lets"
      ],
      "properties": {
        "ui_protocol": {
          "type": "object",
          "additionalProperties": false,
          "required": [
            "version",
            "sha256"
          ],
          "properties": {
            "version": {
              "$ref": "#/$defs/version"
            },
            "sha256": {
              "$ref": "#/$defs/sha256"
            }
          }
        },
        "data_plane": {
          "type": "object",
          "additionalProperties": false,
          "required": [
            "contract_version",
            "schema_revision",
            "read_compatible_from",
            "migration_sha256",
            "blob_layout_version"
          ],
          "properties": {
            "contract_version": {
              "const": "astralplane.contract/v1"
            },
            "schema_revision": {
              "$ref": "#/$defs/revision"
            },
            "read_compatible_from": {
              "$ref": "#/$defs/revision"
            },
            "migration_sha256": {
              "$ref": "#/$defs/sha256"
            },
            "blob_layout_version": {
              "const": "astralplane.blob-layout/v1"
            }
          }
        },
        "primitives": {
          "type": "object",
          "additionalProperties": false,
          "required": [
            "package_version",
            "contract_sha256"
          ],
          "properties": {
            "package_version": {
              "$ref": "#/$defs/version"
            },
            "contract_sha256": {
              "$ref": "#/$defs/sha256",
              "description": "SHA-256 over every src/astralprims/*.py file sorted by repository-relative path. Frame each file as uint32be UTF-8 path length, path bytes, uint64be content length, and raw content bytes."
            }
          }
        },
        "lets": {
          "type": "object",
          "additionalProperties": false,
          "required": [
            "release",
            "api_version",
            "openapi_sha256",
            "receipt_wire_type",
            "scope_profile_version"
          ],
          "properties": {
            "release": {
              "const": "v1.1.0"
            },
            "api_version": {
              "const": "v1"
            },
            "openapi_sha256": {
              "$ref": "#/$defs/sha256"
            },
            "receipt_wire_type": {
              "const": "lets.receipt/v1"
            },
            "scope_profile_version": {
              "const": "astral.tools/v1"
            }
          }
        }
      }
    }
  },
  "$defs": {
    "sha1": {
      "type": "string",
      "pattern": "^[0-9a-f]{40}$"
    },
    "sha256": {
      "type": "string",
      "pattern": "^[0-9a-f]{64}$"
    },
    "version": {
      "type": "string",
      "pattern": "^[0-9]+(?:\\.[0-9]+){0,3}(?:[-+][0-9A-Za-z.-]+)?$"
    },
    "contractVersion": {
      "type": "string",
      "pattern": "^(?:[0-9]+(?:\\.[0-9]+){0,3}(?:[-+][0-9A-Za-z.-]+)?|[a-z][a-z0-9.-]{0,63}(?:\\.contract)?/v[1-9][0-9]*(?:\\.[0-9]+){0,2})$"
    },
    "revision": {
      "type": "string",
      "pattern": "^[0-9]+(?:\\.[0-9]+){1,3}$"
    },
    "baseComponent": {
      "type": "object",
      "additionalProperties": false,
      "required": [
        "repository",
        "path",
        "commit",
        "contract_version"
      ],
      "properties": {
        "repository": {
          "type": "string"
        },
        "path": {
          "type": "string"
        },
        "commit": {
          "$ref": "#/$defs/sha1"
        },
        "ref": {
          "type": [
            "string",
            "null"
          ],
          "minLength": 1,
          "maxLength": 200
        },
        "contract_version": {
          "$ref": "#/$defs/contractVersion"
        },
        "artifact_sha256": {
          "anyOf": [
            {
              "$ref": "#/$defs/sha256"
            },
            {
              "type": "null"
            }
          ]
        }
      }
    },
    "projectionComponent": {
      "allOf": [
        {
          "$ref": "#/$defs/baseComponent"
        },
        {
          "type": "object",
          "properties": {
            "repository": {
              "const": "https://github.com/AstralDeep/AstralProjection.git"
            },
            "path": {
              "const": "components/AstralProjection"
            },
            "contract_version": {
              "const": "astralprojection.contract/v1"
            }
          }
        }
      ]
    },
    "planeComponent": {
      "allOf": [
        {
          "$ref": "#/$defs/baseComponent"
        },
        {
          "type": "object",
          "properties": {
            "repository": {
              "const": "https://github.com/AstralDeep/AstralPlane.git"
            },
            "path": {
              "const": "components/AstralPlane"
            },
            "contract_version": {
              "const": "astralplane.contract/v1"
            }
          }
        }
      ]
    },
    "primitivesComponent": {
      "allOf": [
        {
          "$ref": "#/$defs/baseComponent"
        },
        {
          "type": "object",
          "properties": {
            "repository": {
              "const": "https://github.com/AstralDeep/AstralPrimitives.git"
            },
            "path": {
              "const": "components/AstralPrimitives"
            },
            "contract_version": {
              "const": "0.4.0"
            }
          }
        }
      ]
    },
    "letsComponent": {
      "allOf": [
        {
          "$ref": "#/$defs/baseComponent"
        },
        {
          "type": "object",
          "required": [
            "ref"
          ],
          "properties": {
            "repository": {
              "const": "https://github.com/AstralDeep/LETS.git"
            },
            "path": {
              "const": "components/LETS"
            },
            "ref": {
              "const": "v1.1.0"
            },
            "contract_version": {
              "const": "1.1.0"
            }
          }
        }
      ]
    }
  }
}
