{
  "format": "astral.composition/v1",
  "astraldeep_contract_version": "astraldeep.composition/v1",
  "components": {
    "astral-projection": {
      "repository": "https://github.com/AstralDeep/AstralProjection.git",
      "path": "components/AstralProjection",
      "commit": "345914dc1cf73b36d4408c3724fdea0e1d676f15",
      "contract_version": "astralprojection.contract/v1"
    },
    "astral-plane": {
      "repository": "https://github.com/AstralDeep/AstralPlane.git",
      "path": "components/AstralPlane",
      "commit": "28e946bc6b5eb8183fd2f8157e04dba79306eec0",
      "contract_version": "astralplane.contract/v1"
    },
    "astral-primitives": {
      "repository": "https://github.com/AstralDeep/AstralPrimitives.git",
      "path": "components/AstralPrimitives",
      "commit": "d7b454105ec910cb1734fab6f7e318ac29185873",
      "contract_version": "0.4.0"
    },
    "lets": {
      "repository": "https://github.com/AstralDeep/LETS.git",
      "path": "components/LETS",
      "commit": "ed5c1e4bd61a6b11625d265aeb77229b7c2c017b",
      "ref": "v1.1.0",
      "contract_version": "1.1.0"
    }
  },
  "availability": {
    "astral-projection": "required-embedded",
    "astral-plane": "required-embedded",
    "astral-primitives": "required-embedded",
    "lets": "external-feature-gated"
  },
  "compatibility": {
    "ui_protocol": {
      "version": "1",
      "sha256": "698b692281c9a346e6fff935733c9a9ea523397b8a97bd128e2a490dd5480175"
    },
    "data_plane": {
      "contract_version": "astralplane.contract/v1",
      "schema_revision": "089.014",
      "read_compatible_from": "066.001",
      "migration_sha256": "5a03a9f11a22530ae80a11036d0ddaf72d084797546285a71ebdbc3fd741bb06",
      "blob_layout_version": "astralplane.blob-layout/v1"
    },
    "primitives": {
      "package_version": "0.4.0",
      "contract_sha256": "4ad92393e2aec3686ffb0e9d80d35b29ab6fd9fa32476e6aef564f7a35dc2a0f"
    },
    "lets": {
      "release": "v1.1.0",
      "api_version": "v1",
      "openapi_sha256": "7c69e181d0d941ddb97c3934c8376e0c2d59eaa74ef8f7a1109bd7016251fb29",
      "receipt_wire_type": "lets.receipt/v1",
      "scope_profile_version": "astral.tools/v1"
    }
  }
}
